{
  "version": 1,
  "revision": 0,
  "latest_app_version": "0.1.2",
  "link_urls": {
    "one_rom": "https://onerom.org",
    "piers_rocks": "https://piers.rocks",
    "zadig": "https://zadig.akeo.ie/",
    "win_usb": "https://onerom.org/web/#windows",
    "github_issue": "https://github.com/piersfinlayson/one-rom/issues",
    "linux_udev": "https://onerom.org/web/#linux",
    "rom_configs": "https://images.onerom.org/#rom-configs",
    "app_update": "https://onerom.org/studio/#downloads"
  },
  "manifest_urls": {
    "fw_release": "https://images.onerom.org/releases.json",
    "rom_config": "https://images.onerom.org/configs.json",
    "app_release": "https://images.onerom.org/studio/releases.json"
  },
  "schema_urls": {
    "app_manifest": "https://images.onerom.org/studio/app-schema.json",
    "rom_config": "https://images.onerom.org/configs/schema.json",
    "fw_release": "",
    "app_release": ""
  },
  "paths": {
    "firmware_releases": "https://images.onerom.org/",
    "rom_configs": "https://images.onerom.org/"
  }
}